[
{"id":"adniel","name":"Adniel","type":"Crafting NPC","locations":[{"map_id":"elveland","map_name":"Elveland","x":38,"y":215},{"map_id":"acheron","map_name":"Acheron","x":null,"y":null}],"description":"Adniel can craft and upgrade Errtel items! She can also add and upgrade +Elemental Wing Option on Tier 4 Wings & Capes!","sells":[],"image_url":"https://muonlinefanz.com/tools/npc/data/graphics/Adniel/Adniel.jpg","season":null,"source":"fanz","source_url":"https://muonlinefanz.com/tools/npc/data/npcdb/Adniel.php","scraped_at":"2026-10-21T14:11:03Z","page_updated_at":null},
{"id":"angela-the-supplier","name":"Angela The Supplier","type":"Merchant NPC","locations":[{"map_id":"valley-of-loren","map_name":"Valley of Loren","x":92,"y":219}],"description":"Angela The Supplier offers general items for sale including health potions, mana potions, Arrows and Bolts, Town Portal Scroll, Armor of Guardsman, and other miscellaneous items.","sells":[{"item_id":"apple","item_name":"Apple","category":"Recovery Items","price_zen":20,"details":null},{"item_id":"small-healing-potion","item_name":"Small Healing Potion","category":"Recovery Items","price_zen":80,"details":null},{"item_id":"healing-potion","item_name":"Healing Potion","category":"Recovery Items","price_zen":330,"details":null},{"item_id":"large-healing-potion","item_name":"Large Healing Potion","category":"Recovery Items","price_zen":1500,"details":null},{"item_id":"small-mana-potion","item_name":"Small Mana Potion","category":"Recovery Items","price_zen":80,"details":null},{"item_id":"mana-potion","item_name":"Mana Potion","category":"Recovery Items","price_zen":330,"details":null},{"item_id":"large-mana-potion","item_name":"Large Mana Potion","category":"Recovery Items","price_zen":1500,"details":null},{"item_id":"antidote","item_name":"Antidote","category":"Recovery Items","price_zen":80,"details":null},{"item_id":"apple-1","item_name":"Apple +1","category":"Recovery Items","price_zen":40,"details":null},{"item_id":"small-healing-potion-1","item_name":"Small Healing Potion +1","category":"Recovery Items","price_zen":160,"details":null},{"item_id":"healing-potion-1","item_name":"Healing Potion +1","category":"Recovery Items","price_zen":660,"details":null},{"item_id":"large-healing-potion-1","item_name":"Large Healing Potion +1","category":"Recovery Items","price_zen":3000,"details":null},{"item_id":"bolt","item_name":"Bolt","category":"Other Items","price_zen":100,"details":null},{"item_id":"bolt-1","item_name":"Bolt +1","category":"Other Items","price_zen":1400,"details":null},{"item_id":"bolt-2","item_name":"Bolt +2","category":"Other Items","price_zen":2200,"details":null},{"item_id":"bolt-3","item_name":"Bolt +3","category":"Other Items","price_zen":3000,"details":null},{"item_id":"arrow","item_name":"Arrow","category":"Other Items","price_zen":70,"details":null},{"item_id":"arrow-1","item_name":"Arrow +1","category":"Other Items","price_zen":1200,"details":null},{"item_id":"arrow-2","item_name":"Arrow +2","category":"Other Items","price_zen":2000,"details":null},{"item_id":"arrow-3","item_name":"Arrow +3","category":"Other Items","price_zen":2800,"details":null},{"item_id":"town-portal-scroll","item_name":"Town Portal Scroll","category":"Other Items","price_zen":750,"details":null},{"item_id":"armor-of-guardsman","item_name":"Armor of Guardsman","category":"Other Items","price_zen":5000,"details":null},{"item_id":"muun-energy-converter","item_name":"Muun Energy Converter","category":"Other Items","price_zen":900000,"details":null},{"item_id":"elemental-rune","item_name":"Elemental Rune","category":"Other Items","price_zen":80000000,"details":null},{"item_id":"sphere","item_name":"Sphere","category":"Other Items","price_zen":30000000,"details":null},{"item_id":"archer","item_name":"Archer","category":"Other Items","price_zen":1500000,"details":null},{"item_id":"spearman","item_name":"Spearman","category":"Other Items","price_zen":1200000,"details":null}],"image_url":"https://muonlinefanz.com/tools/npc/data/graphics/Angela%20The%20Supplier/Angela%20The%20Supplier.jpg","season":null,"source":"fanz","source_url":"https://muonlinefanz.com/tools/npc/data/npcdb/Angela%20The%20Supplier.php","scraped_at":"2026-10-21T14:11:05Z","page_updated_at":null},
{"id":"apostle-devin","name":"Apostle Devin","type":"Quest NPC","locations":[{"map_id":"crywolf","map_name":"Crywolf","x":228,"y":48}],"description":"Apostle Devin is searching for a mighty warrior to accept a very difficult quest. Ultimately, he plans to infiltrate Balgass' Barracks and kill the evil war lord, Dark Elf, that lurks within! It will not be an easy task. Agree to help him and he will bless you with special abilities.","sells":[],"image_url":"https://muonlinefanz.com/tools/npc/data/graphics/Apostle%20Devin/Apostle%20Devin.jpg","season":null,"source":"fanz","source_url":"https://muonlinefanz.com/tools/npc/data/npcdb/Apostle%20Devin.php","scraped_at":"2026-10-21T14:11:06Z","page_updated_at":null},
{"id":"arena-guard","name":"Arena Guard","type":"Merchant NPC","locations":[{"map_id":"arena","map_name":"Arena","x":72,"y":164}],"description":"Arena Guard offers general items for sale including health potions, mana potions, Arrows and Bolts, Town Portal Scroll, Armor of Guardsman, and other miscellaneous items.","sells":[{"item_id":"apple","item_name":"Apple","category":"Recovery Items","price_zen":20,"details":null},{"item_id":"small-healing-potion","item_name":"Small Healing Potion","category":"Recovery Items","price_zen":80,"details":null},{"item_id":"healing-potion","item_name":"Healing Potion","category":"Recovery Items","price_zen":330,"details":null},{"item_id":"large-healing-potion","item_name":"Large Healing Potion","category":"Recovery Items","price_zen":1500,"details":null},{"item_id":"small-mana-potion","item_name":"Small Mana Potion","category":"Recovery Items","price_zen":80,"details":null},{"item_id":"mana-potion","item_name":"Mana Potion","category":"Recovery Items","price_zen":330,"details":null},{"item_id":"large-mana-potion","item_name":"Large Mana Potion","category":"Recovery Items","price_zen":1500,"details":null},{"item_id":"antidote","item_name":"Antidote","category":"Recovery Items","price_zen":80,"details":null},{"item_id":"apple-1","item_name":"Apple +1","category":"Recovery Items","price_zen":40,"details":null},{"item_id":"small-healing-potion-1","item_name":"Small Healing Potion +1","category":"Recovery Items","price_zen":160,"details":null},{"item_id":"healing-potion-1","item_name":"Healing Potion +1","category":"Recovery Items","price_zen":660,"details":null},{"item_id":"large-healing-potion-1","item_name":"Large Healing Potion +1","category":"Recovery Items","price_zen":3000,"details":null},{"item_id":"bolt","item_name":"Bolt","category":"Other Items","price_zen":100,"details":null},{"item_id":"bolt-1","item_name":"Bolt +1","category":"Other Items","price_zen":1400,"details":null},{"item_id":"bolt-2","item_name":"Bolt +2","category":"Other Items","price_zen":2200,"details":null},{"item_id":"bolt-3","item_name":"Bolt +3","category":"Other Items","price_zen":3000,"details":null},{"item_id":"arrow","item_name":"Arrow","category":"Other Items","price_zen":70,"details":null},{"item_id":"arrow-1","item_name":"Arrow +1","category":"Other Items","price_zen":1200,"details":null},{"item_id":"arrow-2","item_name":"Arrow +2","category":"Other Items","price_zen":2000,"details":null},{"item_id":"arrow-3","item_name":"Arrow +3","category":"Other Items","price_zen":2800,"details":null},{"item_id":"town-portal-scroll","item_name":"Town Portal Scroll","category":"Other Items","price_zen":750,"details":null},{"item_id":"armor-of-guardsman","item_name":"Armor of Guardsman","category":"Other Items","price_zen":5000,"details":null},{"item_id":"muun-energy-converter","item_name":"Muun Energy Converter","category":"Other Items","price_zen":900000,"details":null},{"item_id":"elemental-rune","item_name":"Elemental Rune","category":"Other Items","price_zen":80000000,"details":null},{"item_id":"sphere","item_name":"Sphere","category":"Other Items","price_zen":30000000,"details":null},{"item_id":"archer","item_name":"Archer","category":"Other Items","price_zen":1500000,"details":null},{"item_id":"spearman","item_name":"Spearman","category":"Other Items","price_zen":1200000,"details":null}],"image_url":"https://muonlinefanz.com/tools/npc/data/graphics/Arena%20Guard/Arena%20Guard.jpg","season":null,"source":"fanz","source_url":"https://muonlinefanz.com/tools/npc/data/npcdb/Arena%20Guard.php","scraped_at":"2026-10-21T14:09:27Z","page_updated_at":null},
{"id":"captain-slough","name":"Captain Slough","type":"Miscellaneous NPC","locations":[{"map_id":"noria","map_name":"Noria","x":197,"y":113}],"description":"Captain Slough will warp you to Acheron in exchange for a Spirit Map item.","sells":[],"image_url":"https://muonlinefanz.com/tools/npc/data/graphics/Captain%20Slough/Captain%20Slough.jpg","season":null,"source":"fanz","source_url":"https://muonlinefanz.com/tools/npc/data/npcdb/Captain%20Slough.php","scraped_at":"2026-10-21T14:11:07Z","page_updated_at":null},